{
  "schema_version": 1,
  "registry_kind": "orbit_q_post_snapshot_reserve_design_registry",
  "frozen_snapshot": {
    "candidates.jsonl_sha256": "7cb0126157a40bab5c9c5aa5d7f0f923491c753430a91458b0896a53963afb90",
    "shortlist.json_sha256": "e6d7fa8f9602d2fad5997ba2cd191f90a976a476784c8c96feaf5ccf5d74bdea",
    "summary.json_sha256": "a31456652045b48b5dfb0d0fb4be4f43e1ad946ef2cd768f0eebb020f58eb3b9"
  },
  "reserves": [
    {
      "candidate_id": "r116_coherent_toric_recovery_portfolio--post_shortlist_reserve--robust_selection",
      "slug": "coherent-toric-recovery-portfolio",
      "problem_id": 116,
      "lifecycle_status": "design_only",
      "blueprint_path": "blueprints/coherent-toric-recovery-portfolio",
      "artifacts": {
        "blueprint_metadata": {
          "path": "blueprint.json",
          "sha256": "8d9edc31b04e6372646d16d31790789f68b53cd96b86ad812f81b12c2680c75a"
        },
        "instruction": {
          "path": "instruction.md",
          "sha256": "79169a2629979ea41828c541a08601baddf0a3ea151b253744a6ada3afb0b347"
        },
        "evaluator": {
          "path": "evaluate_116.py",
          "sha256": "6fb24139a8fc8d34869ad1a7d6e6b13326be6d1c61d78c2aefe3d5bdd8e443ef"
        },
        "expert_solution": {
          "path": "expert/solution_116.py",
          "sha256": "e1faf817f804fd0cbfb1a60a63d4e26520f08cccc433bb1f8c98ec40c1cdde2a"
        }
      },
      "blueprint_bundle_sha256": "83bc7317ee791e9e95f9b851f3ec25519896ba323394c26e1ac2548e3ca34cbb",
      "audit_status": {
        "classification": "design_only",
        "scientific_design_review": "completed_with_blockers",
        "local_oracle_status": "validated_nonbinding",
        "tensorcircuit_expert_status": "not_executed",
        "pinned_image_status": "not_executed",
        "harbor_status": "not_executed",
        "solver_model_status": "not_executed",
        "hardness_status": "no_claim",
        "execution_authorized": false
      },
      "entry_hash": "f823df8a523b83494facdb8010379ee0eadad5d74f6a4954b94964f11df2f3b8"
    },
    {
      "candidate_id": "r117_replica_transfer_program_synthesis--post_shortlist_reserve--shared_contraction_dag",
      "slug": "replica-transfer-program-synthesis",
      "problem_id": 117,
      "lifecycle_status": "design_only",
      "blueprint_path": "blueprints/replica-transfer-program-synthesis",
      "artifacts": {
        "blueprint_metadata": {
          "path": "blueprint.json",
          "sha256": "50a090d5f982e99347e387409bc6995e9e7db3dd1e3c8071a3968d595bf778f4"
        },
        "instruction": {
          "path": "instruction.md",
          "sha256": "bd5fdf98e1731ab5a23a31d0c41b61306c87b2e12671ba13a4a3b91f37356baf"
        },
        "evaluator": {
          "path": "evaluate_117.py",
          "sha256": "cd65938c88dae379053dcb6cb3a818383e6a26f6cc30b73ff77d20dd08372c70"
        },
        "expert_solution": {
          "path": "expert/solution_117.py",
          "sha256": "8907162e623fca2e447fe47d0b669f3f66700bb14866694d874d26ca8fca0ed6"
        }
      },
      "blueprint_bundle_sha256": "44c1717d039fef6e9dd44d337cd229c7cbb70ca064749e83ecd9e1c017f11b93",
      "audit_status": {
        "classification": "design_only",
        "scientific_design_review": "completed_with_blockers",
        "local_oracle_status": "validated_nonbinding",
        "tensorcircuit_expert_status": "not_executed",
        "pinned_image_status": "not_executed",
        "harbor_status": "not_executed",
        "solver_model_status": "not_executed",
        "hardness_status": "no_claim",
        "execution_authorized": false
      },
      "entry_hash": "08cd23733d23147fc6f0e2d3428f0052ec5293143539ceca1cc19c64a743da1a"
    },
    {
      "candidate_id": "r118_process_tensor_qec_policy--post_shortlist_reserve--robust_synthesis",
      "slug": "process-tensor-qec-policy",
      "problem_id": 118,
      "lifecycle_status": "design_only",
      "blueprint_path": "blueprints/process-tensor-qec-policy",
      "artifacts": {
        "blueprint_metadata": {
          "path": "blueprint.json",
          "sha256": "a4dbd1a8bbed0148fef8e9d40926b84d1a985c1bd51106359df3fdc1e43391e6"
        },
        "instruction": {
          "path": "instruction.md",
          "sha256": "3c145a4e5e249f42e822de6aca5deeb9baf7ddc2f0b18172e768d94a847d4e8d"
        },
        "evaluator": {
          "path": "evaluate_118.py",
          "sha256": "847ddd0d2b9fa7f7190a447c3e747b417dd879b7be805e3f68d6c6265baa22d2"
        },
        "expert_solution": {
          "path": "expert/solution_118.py",
          "sha256": "642347260af002553bc903d1722699ee2785c7243c08c87d366ea252f5c308ce"
        }
      },
      "blueprint_bundle_sha256": "f356ea8347c25caf1b6632d7b5e98b43799b33cbac0bc2d571c4bfc082c58661",
      "audit_status": {
        "classification": "design_only",
        "scientific_design_review": "completed_with_blockers",
        "local_oracle_status": "validated_nonbinding",
        "tensorcircuit_expert_status": "not_executed",
        "pinned_image_status": "not_executed",
        "harbor_status": "not_executed",
        "solver_model_status": "not_executed",
        "hardness_status": "no_claim",
        "execution_authorized": false
      },
      "entry_hash": "f9bb22deffafecde05d9a3dee4a056ee3b327047d24aaa60bef977fef28eba50"
    },
    {
      "candidate_id": "r119_robust_lightcone_cut_planner--post_shortlist_reserve--partition_allocation_synthesis",
      "slug": "robust-lightcone-cut-planner",
      "problem_id": 119,
      "lifecycle_status": "design_only",
      "blueprint_path": "blueprints/robust-lightcone-cut-planner",
      "artifacts": {
        "blueprint_metadata": {
          "path": "blueprint.json",
          "sha256": "44c476eb566f88f4df28f58749ee002c36a37994b2d00fd15a96599a9c7ec9b0"
        },
        "instruction": {
          "path": "instruction.md",
          "sha256": "597e69d5b73d0a9da9ff30fd5a2910dede657e5045e6a76618e2daa0347e7ccb"
        },
        "evaluator": {
          "path": "evaluate_119.py",
          "sha256": "b90ee879f3605cb20cfb2fbf1a8b3f7d5344b9a5ebebb37852ed9290b8602a08"
        },
        "expert_solution": {
          "path": "expert/solution_119.py",
          "sha256": "b18024a97a2fc23c02166f52229e8002f6d14ae53cab491e56b09567b67f3b0d"
        }
      },
      "blueprint_bundle_sha256": "00b30eb7e076156819f81917a4563d33bdc4da487e56c073794b0e1484cbdb11",
      "audit_status": {
        "classification": "design_only",
        "scientific_design_review": "completed_with_blockers",
        "local_oracle_status": "validated_nonbinding",
        "tensorcircuit_expert_status": "not_executed",
        "pinned_image_status": "not_executed",
        "harbor_status": "not_executed",
        "solver_model_status": "not_executed",
        "hardness_status": "no_claim",
        "execution_authorized": false
      },
      "entry_hash": "8be84d9f43834208cae5d4c8fbb1903defd503991668416f45437e1c51a867aa"
    },
    {
      "candidate_id": "r120_flagged_css_gadget_synthesis--post_shortlist_reserve--robust_fault_tolerant_implementation",
      "slug": "robust-flagged-css-gadget",
      "problem_id": 120,
      "lifecycle_status": "design_only",
      "blueprint_path": "blueprints/robust-flagged-css-gadget",
      "artifacts": {
        "blueprint_metadata": {
          "path": "blueprint.json",
          "sha256": "fc4f3589c9b30518813276d02adca4649c61ef90e22bb8a4fd36f5f9b61d127b"
        },
        "instruction": {
          "path": "instruction.md",
          "sha256": "57375ff067d9d92f25dd243aef6171fcd4fbf42c156b25b3b9742ab1f351dee8"
        },
        "evaluator": {
          "path": "evaluate_120.py",
          "sha256": "ce2ce2626cb735cd4aeefadf5daa4415e603b8a6795ea1e971c42c0b20f741ff"
        },
        "expert_solution": {
          "path": "expert/solution_120.py",
          "sha256": "2a21f737d343e22c86e5dedd5660225c6a5165c16d407690a80da76fc7a6010c"
        }
      },
      "blueprint_bundle_sha256": "e2f36a0620ad275b5187c64d9441ad8989f7c82b099aebd95a9b9db222747c39",
      "audit_status": {
        "classification": "design_only",
        "scientific_design_review": "completed_with_blockers",
        "local_oracle_status": "validated_nonbinding",
        "tensorcircuit_expert_status": "not_executed",
        "pinned_image_status": "not_executed",
        "harbor_status": "not_executed",
        "solver_model_status": "not_executed",
        "hardness_status": "no_claim",
        "execution_authorized": false
      },
      "entry_hash": "6577a09a9329d1abf092e92a14f7eea941e8b32880d4b5f63f32b25aa5c141e8"
    },
    {
      "candidate_id": "r121_verifier_executed_batched_amplitude_compiler--post_shortlist_reserve--symbolic_contraction_program",
      "slug": "verifier-executed-amplitude-compiler",
      "problem_id": 121,
      "lifecycle_status": "design_only",
      "blueprint_path": "blueprints/verifier-executed-amplitude-compiler",
      "artifacts": {
        "blueprint_metadata": {
          "path": "blueprint.json",
          "sha256": "b01bb94e96f7bd057c796b736bf0922d7cb4e34ffa12f80c08dfefdba0062526"
        },
        "instruction": {
          "path": "instruction.md",
          "sha256": "6263ac9cd730ba66b4b77280ece793dc4124afdd63b30e51e041d662fac02327"
        },
        "evaluator": {
          "path": "evaluate_121.py",
          "sha256": "d941c947c983b7ea77710831207aee84f8bab473d856c564b78a508808077cbd"
        },
        "expert_solution": {
          "path": "expert/solution_121.py",
          "sha256": "14a007ad574ac472e65aa8e8824d4d6b8f849f26df0e19d40a33215bc06ea59d"
        }
      },
      "blueprint_bundle_sha256": "3dfa3364d4880fcaafd4bb999813c396ede092147038e749af84ba14d5b8a2f9",
      "audit_status": {
        "classification": "design_only",
        "scientific_design_review": "completed_with_blockers",
        "local_oracle_status": "validated_nonbinding",
        "tensorcircuit_expert_status": "not_executed",
        "pinned_image_status": "not_executed",